Id;szoveg;Kuldo; Idopont;MessageId;
23;én úgy tudom, hogy 3 éves kortól kötelezô az óvoda. A jó magánovikba hamar elfogynak a helyek, én biztosra mentem és tavaly végignéztem azokat a helyeket, ahova beírattam volna a lányomat, és még januárban a zulgói Tengerszem óvoda mellett döntottem. Nekünk teljesen bevált, negatívunot nem is tudok említeni, szerintem kezd el idöben azaz most és nézz meg lehetöség szerint több ovit is, majd meglátod melyik tetszik a legjobban. ;1eb69fe4-84d2-4a51-90ac-02511c6dee89;2022. 04. 16. 13:23:57;14
24;3 eves kortól kell oviba járnia a gyerekeknek úgy tudom. Köszi az infót megnéztem a kerület jobb ovijait és a Tengerszem óvoda weblapja a leginformatívebb és ott láttam a legkomplexebb programot. Köszi, megyek is gyorsan időpontot foglalni, hogy legyen még hely. 😊;eb5396c9-eb1d-41d3-ae9e-238e63edd9ac;2022. 04. 16. 13:25:59;14
25;Sziasztok. Mi is pamperst  használtunk, az vált be a legjobban, sajnos ennél pénztárcabarátabb megoldást mi sem találtunk. Próbálkoztunk öko pelenkákkal is, sajnos azoknak az ára általában még borsosabb volt ha beváltak, ha nem. Amelyik pedig anyagilag jobban megérte volna, azokban többnyire sajnos csalódnunk kellett, hiába ígért teljes szárazságot, és hogy nem folyik ki belőle a bele való, hát valahogy mégis kijutott... szóval az ötleteket én is és a párom is szívesen fogadnánk. ;b526d4da-769c-4fe6-bbeb-8b4c65e92ff7;2022. 04. 16. 13:31:26;15
26;Nekünk a Bella Baby Happy jött be a legjobban. Olcsóbb és talán jobb is mint a Pampers, Libero.;1eb69fe4-84d2-4a51-90ac-02511c6dee89;2022. 04. 16. 13:32:54;15
27;Szia! :) mi is szoktunk járni arra a játszótére majd valamikor a héten találkozunk.;b7d03b41-aa0c-46a0-a13a-0ceb9f8719a1;2022. 04. 16. 13:35:04;16